{
 "amazon": {
  "name": "Amazon Ads",
  "currencyNote": "Sales/Spend in INR; ACOS = Spend/Sales",
  "reports": [
   {
    "id": "exec",
    "title": "Account / Executive Performance",
    "level": "Day / week / month",
    "question": "How is Amazon advertising performing overall and is spend translating into sales?",
    "metrics": [
     {
      "key": "spend",
      "label": "Spend",
      "unit": "inr"
     },
     {
      "key": "impressions",
      "label": "Impressions",
      "unit": "num"
     },
     {
      "key": "clicks",
      "label": "Clicks",
      "unit": "num"
     },
     {
      "key": "ctr",
      "label": "CTR",
      "unit": "pct"
     },
     {
      "key": "cpc",
      "label": "CPC",
      "unit": "inr",
      "invert": true
     },
     {
      "key": "sales",
      "label": "Sales",
      "unit": "inr"
     },
     {
      "key": "orders",
      "label": "Orders",
      "unit": "num"
     },
     {
      "key": "units",
      "label": "Units",
      "unit": "num"
     },
     {
      "key": "roas",
      "label": "ROAS",
      "unit": "x"
     },
     {
      "key": "acos",
      "label": "ACOS",
      "unit": "pct",
      "invert": true
     },
     {
      "key": "cvr",
      "label": "Conversion rate",
      "unit": "pct"
     },
     {
      "key": "ntb_sales",
      "label": "New-to-brand",
      "unit": "inr"
     }
    ],
    "representation": "KPI strip + trend lines (Spend, Sales, ROAS/ACOS); vertical bars for period comparison",
    "grid": false,
    "entity": "account",
    "source": "gold"
   },
   {
    "id": "campaign",
    "title": "Campaign Performance",
    "level": "Campaign",
    "question": "Which campaigns are driving sales efficiently?",
    "metrics": [
     {
      "key": "spend",
      "label": "Spend",
      "unit": "inr"
     },
     {
      "key": "impressions",
      "label": "Impressions",
      "unit": "num"
     },
     {
      "key": "clicks",
      "label": "Clicks",
      "unit": "num"
     },
     {
      "key": "ctr",
      "label": "CTR",
      "unit": "pct"
     },
     {
      "key": "cpc",
      "label": "CPC",
      "unit": "inr",
      "invert": true
     },
     {
      "key": "sales",
      "label": "Sales",
      "unit": "inr"
     },
     {
      "key": "orders",
      "label": "Orders",
      "unit": "num"
     },
     {
      "key": "units",
      "label": "Units",
      "unit": "num"
     },
     {
      "key": "roas",
      "label": "ROAS",
      "unit": "x"
     },
     {
      "key": "acos",
      "label": "ACOS",
      "unit": "pct",
      "invert": true
     },
     {
      "key": "cvr",
      "label": "Conversion rate",
      "unit": "pct"
     }
    ],
    "representation": "Campaign table + horizontal bars ranked by ROAS / Sales / Spend; trend line when a campaign is selected",
    "grid": true,
    "gridAxes": "Rows = campaigns; columns = selected KPI",
    "entity": "campaign",
    "source": "gold"
   },
   {
    "id": "asin",
    "title": "Product / ASIN Performance",
    "level": "Advertised product / ASIN",
    "question": "Which products are actually benefiting from advertising?",
    "metrics": [
     {
      "key": "impressions",
      "label": "Impressions",
      "unit": "num"
     },
     {
      "key": "clicks",
      "label": "Clicks",
      "unit": "num"
     },
     {
      "key": "sales",
      "label": "Sales",
      "unit": "inr"
     },
     {
      "key": "orders",
      "label": "Orders",
      "unit": "num"
     },
     {
      "key": "units",
      "label": "Units",
      "unit": "num"
     },
     {
      "key": "spend",
      "label": "Spend",
      "unit": "inr"
     },
     {
      "key": "roas",
      "label": "ROAS",
      "unit": "x"
     },
     {
      "key": "acos",
      "label": "ACOS",
      "unit": "pct",
      "invert": true
     },
     {
      "key": "ntb_sales",
      "label": "NTB sales",
      "unit": "inr"
     }
    ],
    "representation": "Product table + horizontal bar ranking by Sales or ROAS; trend line for selected ASIN",
    "grid": true,
    "gridAxes": "Rows = ASINs; columns = ROAS / ACOS / Sales / Spend",
    "entity": "asin",
    "source": "gold"
   },
   {
    "id": "search",
    "title": "Search Term Performance",
    "level": "Search term",
    "question": "Which shopper queries are generating or wasting spend?",
    "metrics": [
     {
      "key": "impressions",
      "label": "Impressions",
      "unit": "num"
     },
     {
      "key": "clicks",
      "label": "Clicks",
      "unit": "num"
     },
     {
      "key": "ctr",
      "label": "CTR",
      "unit": "pct"
     },
     {
      "key": "cpc",
      "label": "CPC",
      "unit": "inr",
      "invert": true
     },
     {
      "key": "spend",
      "label": "Spend",
      "unit": "inr"
     },
     {
      "key": "orders",
      "label": "Orders",
      "unit": "num"
     },
     {
      "key": "sales",
      "label": "Sales",
      "unit": "inr"
     },
     {
      "key": "roas",
      "label": "ROAS",
      "unit": "x"
     },
     {
      "key": "acos",
      "label": "ACOS",
      "unit": "pct",
      "invert": true
     }
    ],
    "representation": "Search-term table + horizontal bars for Sales / Spend / ROAS; trend line for selected term",
    "grid": true,
    "gridAxes": "Rows = search terms; columns = CTR / CPC / ACOS / ROAS",
    "dimensions": [
     {
      "key": "search_term",
      "label": "Search term"
     }
    ],
    "entity": "search",
    "source": "bronze"
   },
   {
    "id": "targeting",
    "title": "Targeting / Keyword Performance",
    "level": "Keyword / product target",
    "question": "Which targets deserve more budget or bid attention?",
    "metrics": [
     {
      "key": "impressions",
      "label": "Impressions",
      "unit": "num"
     },
     {
      "key": "clicks",
      "label": "Clicks",
      "unit": "num"
     },
     {
      "key": "ctr",
      "label": "CTR",
      "unit": "pct"
     },
     {
      "key": "cpc",
      "label": "CPC",
      "unit": "inr",
      "invert": true
     },
     {
      "key": "spend",
      "label": "Spend",
      "unit": "inr"
     },
     {
      "key": "orders",
      "label": "Orders",
      "unit": "num"
     },
     {
      "key": "sales",
      "label": "Sales",
      "unit": "inr"
     },
     {
      "key": "roas",
      "label": "ROAS",
      "unit": "x"
     },
     {
      "key": "acos",
      "label": "ACOS",
      "unit": "pct",
      "invert": true
     }
    ],
    "representation": "Targeting table + horizontal ranking bars; grid for target efficiency",
    "grid": true,
    "gridAxes": "Rows = targets; columns = Spend, Sales, ROAS, ACOS",
    "dimensions": [
     {
      "key": "targeting",
      "label": "Target"
     },
     {
      "key": "match_type",
      "label": "Match type"
     }
    ],
    "entity": "targeting",
    "source": "gold"
   },
   {
    "id": "placement",
    "title": "Placement Performance",
    "level": "Placement",
    "question": "Where on Amazon are ads performing best?",
    "metrics": [
     {
      "key": "impressions",
      "label": "Impressions",
      "unit": "num"
     },
     {
      "key": "clicks",
      "label": "Clicks",
      "unit": "num"
     },
     {
      "key": "ctr",
      "label": "CTR",
      "unit": "pct"
     },
     {
      "key": "cpc",
      "label": "CPC",
      "unit": "inr",
      "invert": true
     },
     {
      "key": "spend",
      "label": "Spend",
      "unit": "inr"
     },
     {
      "key": "orders",
      "label": "Orders",
      "unit": "num"
     },
     {
      "key": "sales",
      "label": "Sales",
      "unit": "inr"
     },
     {
      "key": "roas",
      "label": "ROAS",
      "unit": "x"
     },
     {
      "key": "acos",
      "label": "ACOS",
      "unit": "pct",
      "invert": true
     }
    ],
    "representation": "Placement table + vertical bars for Sales/ROAS; trend line by placement",
    "grid": true,
    "gridAxes": "Rows = campaigns; columns = placements (top of search / rest of search / product pages); cells = ROAS or ACOS",
    "dimensions": [
     {
      "key": "placement",
      "label": "Placement"
     }
    ],
    "entity": "placement",
    "source": "bronze"
   },
   {
    "id": "budget",
    "title": "Budget & Pacing",
    "level": "Campaign / day",
    "question": "Are campaigns spending at the intended rate?",
    "metrics": [
     {
      "key": "daily_budget",
      "label": "Daily budget",
      "unit": "inr"
     },
     {
      "key": "spend",
      "label": "Spend",
      "unit": "inr"
     },
     {
      "key": "budget_utilization_pct",
      "label": "Budget utilization %",
      "unit": "pct"
     },
     {
      "key": "remaining_budget",
      "label": "Remaining budget",
      "unit": "inr"
     },
     {
      "key": "impressions",
      "label": "Impressions",
      "unit": "num"
     },
     {
      "key": "clicks",
      "label": "Clicks",
      "unit": "num"
     },
     {
      "key": "sales",
      "label": "Sales",
      "unit": "inr"
     },
     {
      "key": "roas",
      "label": "ROAS",
      "unit": "x"
     },
     {
      "key": "acos",
      "label": "ACOS",
      "unit": "pct",
      "invert": true
     }
    ],
    "representation": "Daily trend lines for spend vs budget; campaign table; vertical bars for budget utilization",
    "grid": true,
    "gridAxes": "Rows = campaigns; columns = dates; cells = spend-to-budget %",
    "entity": "budget",
    "source": "gold"
   },
   {
    "id": "time",
    "title": "Performance Over Time",
    "level": "Day / week / month",
    "question": "How are spend, CPC and sales efficiency changing over time?",
    "metrics": [
     {
      "key": "spend",
      "label": "Spend",
      "unit": "inr"
     },
     {
      "key": "clicks",
      "label": "Clicks",
      "unit": "num"
     },
     {
      "key": "cpc",
      "label": "CPC",
      "unit": "inr",
      "invert": true
     },
     {
      "key": "impressions",